{
  "caseId": "av-write",
  "description": "Write ACCESS_VIOLATION to unmapped address 0xDEADBEEF.",
  "stub": false,
  "exception": {
    "code": "c0000005",
    "hintContains": "ACCESS_VIOLATION"
  },
  "access": "Write",
  "addressClass": "Other",
  "inputInfluence": "UNKNOWN",
  "harness": {
    "executable": "targets/debugger-corpus/debugger_corpus_fault.exe",
    "arg": "av-write",
    "alternateTarget": "randall-vulndrone TCP HELLO expand"
  }
}
