{
  "caseId": "oob-write",
  "description": "Out-of-bounds heap write — managed fixture until native overrun harness lands.",
  "stub": true,
  "exception": {
    "code": "c0000005",
    "hintContains": "ACCESS_VIOLATION"
  },
  "access": "Write",
  "addressClass": "Heapish",
  "inputInfluence": "UNKNOWN",
  "harness": {
    "executable": "targets/debugger-corpus/debugger_corpus_fault.exe",
    "arg": "oob-write"
  }
}
